x,Position,Candidate Name,MinSample,Votes,Votes %,Party,AC
1,1,Sudhir Kumar Alias Banty Choudhary,8504,"59,092",42.7%,Indian National Congress,
2,2,Subhash Chandra Bosh,8504,"51,102",36.9%,Lok Jan Shakti Party,
3,3,Girja Choudhry,139,"8,026",5.8%,Communist Party Of India,
4,4,Golden Kumar,110,"4,431",3.2%,Garib Janta Dal (Secular),
5,5,Shiv Shankar Prasad Choudhary,101,"3,372",2.4%,Independent,
6,6,Ravishankar Paswan,101,"3,350",2.4%,Samras Samaj Party,
7,7,Jagdish Prasad Das,101,"3,213",2.3%,Bahujan Mukti Party,
8,8,Rekha Das,94,"2,021",1.5%,Bahujan Samaj Party,
