x,Position,Candidate Name,MinSample,Votes,Votes %,Party,AC
1,1,Radhey Shyam Kori,66000,"160,117",31.7%,Samajwadi Party, AC View
2,2,Pyarelal Sankhwar,66000,"149,805",29.7%,Bahujan Samaj Party, AC View
3,3,Kamal Rani,5200,"122,845",24.3%,Bharatiya Janta Party, AC View
4,4,Umakant Manjhi,400,"46,022",9.1%,Apna Dal, AC View
5,5,Askaran Sankhwar,200,"12,353",2.4%,Indian National Congress, AC View
6,6,Lalmani Bharti,200,"5,592",1.1%,Independent, AC View
7,7,Benche Lal Kori,200,"3,411",0.7%,Labour Party (Secular), AC View
8,8,Nandram,200,"2,497",0.5%,Rashtriya Swabhimaan Party, AC View
9,9,Ramsumer Bhartiya,200,"2,124",0.4%,Independent, AC View
