x,Position,Candidate Name,MinSample,Votes,Votes %,Party,AC
1,1,Rajendra Kumar,4800,"157,331",32.3%,Samajwadi Party, AC View
2,2,Dr. Bhagwandass,4800,"119,672",24.6%,Bahujan Samaj Party, AC View
3,3,Harpal Singh Sathi,4200,"117,979",24.3%,Bharatiya Janta Party, AC View
4,4,Deepak Kumar,1000,"76,001",15.6%,Indian National Congress, AC View
5,5,Roop Chand,200,"5,385",1.1%,Shiv Sena, AC View
6,6,Vinod Kumar,200,"3,983",0.8%,Independent, AC View
7,7,Arvind,200,"2,982",0.6%,Uttarakhand Kranti Dal, AC View
8,8,Babu Ram,200,"1,531",0.3%,Independent, AC View
9,9,Ghasita,200,"1,488",0.3%,Independent, AC View
